{
  "id": "2026-10-10-okie-tex-2026",
  "program": "Messier",
  "date": "2026-10-10",
  "site": { "name": "Okie-Tex 2026", "lat": 36.898, "lon": -102.952 },
  "sky": { "sqm": 21.9 },
  "scope": {
    "name": "Orion XT8",
    "type": "Dobsonian",
    "aperture_mm": 203,
    "focal_length_mm": 1200,
    "f_ratio": 5.9
  },
  "observers": ["Test Observer"],
  "notebook": "test-002",
  "pages": [2, 3, 4],
  "header_box": { "page": 2, "box": [0.03, 0.34, 0.94, 0.27] },
  "observations": [
    {
      "catalog_id": "M31",
      "aka": "Andromeda",
      "ids": ["M31", "NGC 224"],
      "page": 2,
      "local_time": "21:30",
      "seeing": 2,
      "transparency": 4,
      "eyepiece": "25mm Plossl",
      "magnification": 48,
      "filter": "N/A",
      "description": "Dust lanes easy; long halo",
      "box": [0.03, 0.62, 0.94, 0.31]
    },
    {
      "catalog_id": "NGC 7000",
      "aka": "North America Nebula",
      "ids": ["NGC 7000", "C20"],
      "page": 3,
      "local_time": "21:50",
      "seeing": 2,
      "transparency": 4,
      "eyepiece": "32mm Plossl",
      "magnification": 38,
      "filter": "UHC",
      "description": "Gulf of Mexico edge clear with the filter",
      "box": [0.03, 0.02, 0.94, 0.31]
    },
    {
      "catalog_id": "M33",
      "aka": "Triangulum Galaxy",
      "ids": ["M33", "NGC 598"],
      "page": 3,
      "local_time": "22:10",
      "seeing": null,
      "transparency": null,
      "eyepiece": "25mm Plossl",
      "filter": null,
      "description": null,
      "box": [0.03, 0.34, 0.94, 0.31]
    },
    {
      "catalog_id": "M57",
      "aka": "Ring Nebula",
      "ids": ["M57", "NGC 6720"],
      "page": 4,
      "local_time": "22:30",
      "seeing": 2,
      "transparency": 4,
      "eyepiece": "9mm Nagler",
      "magnification": 133,
      "filter": "N/A",
      "description": "Ring obvious; central star not seen",
      "box": [0.03, 0.02, 0.94, 0.31]
    }
  ]
}
