{
  "id": "2025-10-18-okie-tex-2025",
  "program": "Messier",
  "date": "2025-10-18",
  "site": { "name": "Okie-Tex 2025", "lat": 36.898, "lon": -102.952 },
  "sky": { "sqm": 22 },
  "scope": {
    "name": "Celestron 8SE",
    "type": "Schmidt-Cassegrain",
    "aperture_mm": 203,
    "focal_length_mm": 2032,
    "f_ratio": 10
  },
  "observers": ["Test Observer", "Second Observer"],
  "notebook": "test-001",
  "pages": [6, 7, 8],
  "header_box": { "page": 6, "box": [0.03, 0.02, 0.94, 0.27] },
  "observations": [
    {
      "catalog_id": "M31",
      "aka": "Andromeda",
      "ids": ["M31", "NGC 224"],
      "page": 6,
      "local_time": "21:00",
      "seeing": 4,
      "transparency": 5,
      "eyepiece": "25mm Plossl",
      "magnification": 81,
      "filter": "N/A",
      "description": "Huge halo across the field; dust lane on the near side; M32 and M110 both in view",
      "favorite": true,
      "box": [0.03, 0.3, 0.94, 0.31]
    },
    {
      "catalog_id": "M27",
      "aka": "Dumbbell Nebula",
      "ids": ["M27", "NGC 6853"],
      "page": 6,
      "local_time": "21:20",
      "seeing": 4,
      "transparency": 5,
      "eyepiece": "25mm Plossl",
      "magnification": 81,
      "filter": "OIII",
      "description": "Apple core shape, faint fill between the lobes with the filter",
      "box": [0.03, 0.62, 0.94, 0.31]
    },
    {
      "catalog_id": "M57",
      "aka": "Ring Nebula",
      "ids": ["M57", "NGC 6720"],
      "page": 7,
      "local_time": "21:40",
      "seeing": 5,
      "transparency": 5,
      "eyepiece": "9mm Nagler",
      "magnification": 226,
      "filter": "N/A",
      "description": "Smoke ring, darker center, slightly oval",
      "box": [0.03, 0.02, 0.94, 0.31]
    },
    {
      "catalog_id": "M13",
      "aka": "Hercules Cluster",
      "ids": ["M13", "NGC 6205"],
      "page": 7,
      "local_time": "21:55",
      "seeing": 5,
      "transparency": 4,
      "eyepiece": "9mm Nagler",
      "magnification": 226,
      "filter": "N/A",
      "description": "Resolved to the core; propeller dark lanes",
      "box": [0.03, 0.34, 0.94, 0.31]
    },
    {
      "catalog_id": "M45",
      "aka": "Pleiades",
      "ids": ["M45"],
      "page": 8,
      "local_time": "23:30",
      "seeing": 4,
      "transparency": 5,
      "eyepiece": "32mm Plossl",
      "magnification": 63,
      "filter": "N/A",
      "description": "Too big for the field; blue-white stars",
      "box": [0.03, 0.02, 0.94, 0.31]
    },
    {
      "catalog_id": "IC 434",
      "aka": "Horsehead Nebula",
      "ids": ["IC 434"],
      "page": 8,
      "local_time": "02:10",
      "seeing": 2,
      "transparency": 1,
      "eyepiece": "25mm Plossl",
      "magnification": 29,
      "filter": "H-beta",
      "description": "Not seen; the bright strip of IC 434 maybe, no notch",
      "box": [0.03, 0.34, 0.94, 0.31]
    }
  ]
}
